SQL> CREATE VIEW tview AS SELECT
  2  tid,tname,salary
  3  FROM trainerdetails
  4  ;

View created.

SQL> DESC tview;
 Name                                      Null?    Type
 ----------------------------------------- -------- ----------------------------
 TID                                       NOT NULL VARCHAR2(255)
 TNAME                                              VARCHAR2(255)
 SALARY                                    NOT NULL NUMBER(38)

SQL> SELECT * FROM tview;

TID
--------------------------------------------------------------------------------
TNAME
--------------------------------------------------------------------------------
    SALARY
----------
t1
Vaasu
     20000

t2
Anand
     20000

TID
--------------------------------------------------------------------------------
TNAME
--------------------------------------------------------------------------------
    SALARY
----------

t3
Abhishek
     20000

t4
del

TID
--------------------------------------------------------------------------------
TNAME
--------------------------------------------------------------------------------
    SALARY
----------
     20000

t5
Akhil
     20000


SQL> INSERT INTO tview
  2  VALUES('t6','viewName',150000);

1 row created.

SQL> SELECT * FROM tview;

TID
--------------------------------------------------------------------------------
TNAME
--------------------------------------------------------------------------------
    SALARY
----------
t1
Vaasu
     20000

t2
Anand
     20000

TID
--------------------------------------------------------------------------------
TNAME
--------------------------------------------------------------------------------
    SALARY
----------

t3
Abhishek
     20000

t4
del

TID
--------------------------------------------------------------------------------
TNAME
--------------------------------------------------------------------------------
    SALARY
----------
     20000

t5
Akhil
     20000

t6

TID
--------------------------------------------------------------------------------
TNAME
--------------------------------------------------------------------------------
    SALARY
----------
viewName
    150000


6 rows selected.

SQL> DELETE tview WHERE tid='t6';

1 row deleted.

SQL> SELECT * FROM tview;

TID
--------------------------------------------------------------------------------
TNAME
--------------------------------------------------------------------------------
    SALARY
----------
t1
Vaasu
     20000

t2
Anand
     20000

TID
--------------------------------------------------------------------------------
TNAME
--------------------------------------------------------------------------------
    SALARY
----------

t3
Abhishek
     20000

t4
del

TID
--------------------------------------------------------------------------------
TNAME
--------------------------------------------------------------------------------
    SALARY
----------
     20000

t5
Akhil
     20000


SQL> INSERT INTO tview
  2  VALUES('t6','viewName',150000);

1 row created.

SQL> UPDATE  tview
  2  SET salary=170000
  3  WHERE tid='t6';

1 row updated.

SQL> SELECT * FROM tview;

TID
--------------------------------------------------------------------------------
TNAME
--------------------------------------------------------------------------------
    SALARY
----------
t1
Vaasu
     20000

t2
Anand
     20000

TID
--------------------------------------------------------------------------------
TNAME
--------------------------------------------------------------------------------
    SALARY
----------

t3
Abhishek
     20000

t4
del

TID
--------------------------------------------------------------------------------
TNAME
--------------------------------------------------------------------------------
    SALARY
----------
     20000

t5
Akhil
     20000

t6

TID
--------------------------------------------------------------------------------
TNAME
--------------------------------------------------------------------------------
    SALARY
----------
viewName
    170000


6 rows selected.
